{
  "$schema": "http://json-schema.org/draft-07/schema#",
  "$comment": "Schema per F3 STEP 3 (aprile 2026). Descrive la struttura dell'output di correzione strutturale del dispositivo di lettura, prodotta a partire dai breaking points identificati in F3 STEP 2.",
  "title": "StructuralCorrectionOutput",
  "description": "Output di F3 STEP 3: log delle correzioni applicate al dispositivo di lettura configurazionale (F3 STEP 1) sulla base dei breaking points identificati nello stress test (F3 STEP 2). Produce un dispositivo corretto e la documentazione delle scelte di correzione.",

  "type": "object",
  "required": ["step", "theme_id", "domain", "source_device_id", "corrections_log", "corrected_device_id", "corrected_device"],
  "properties": {

    "step": {
      "type": "string",
      "const": "f3_step_3",
      "description": "Identificatore dello step di pipeline. Valore fisso."
    },

    "theme_id": {
      "type": "string",
      "description": "ID del tema, coerente con theme-discovery e theme-verification.",
      "examples": ["tema_01_pointing_precoce"]
    },

    "domain": {
      "type": "string",
      "description": "Dominio professionale del dispositivo corretto, coerente con F3 STEP 1 e STEP 2."
    },

    "source_device_id": {
      "type": "string",
      "description": "Identificatore del dispositivo originale (F3 STEP 1) sottoposto a correzione."
    },

    "corrections_log": {
      "type": "array",
      "description": "Log delle correzioni. Un elemento per ogni breaking point identificato in F3 STEP 2. Deve coprire tutti i breaking_point con present: true identificati nello stress test.",
      "minItems": 1,
      "items": { "$ref": "#/definitions/CorrectionEntry" }
    },

    "corrected_device_id": {
      "type": "string",
      "description": "Identificatore del dispositivo corretto. Convenzione: '{source_device_id}-corrected'."
    },

    "corrected_device": {
      "$ref": "#/definitions/CorrectedReadingDevice",
      "description": "Versione corretta del dispositivo di lettura configurazionale. Stessa struttura di F3 STEP 1 ReadingDevice, con le modifiche applicate dalle correzioni del log."
    }

  },

  "definitions": {

    "CorrectionEntry": {
      "type": "object",
      "required": ["breaking_point_ref", "breaking_point_summary", "correction_type", "rationale"],
      "properties": {

        "breaking_point_ref": {
          "type": "string",
          "description": "Riferimento al case_id in F3 STEP 2 che ha generato il breaking point (es. 'case_02')."
        },

        "breaking_point_summary": {
          "type": "string",
          "description": "Sintesi del breaking point: dove si rompe il dispositivo e perché, estratto da F3 STEP 2."
        },

        "correction_type": {
          "type": "string",
          "enum": ["applicata", "parzialmente_applicata", "non_applicabile"],
          "description": "Tipo di correzione. applicata: il breaking point è risolto tramite modifica del dispositivo. parzialmente_applicata: il dispositivo viene migliorato ma il limite non è completamente eliminabile a questo livello. non_applicabile: il breaking point rivela un limite strutturale del modello che non è correggibile nel dispositivo — richiede revisione della micro-matrice o degli step precedenti."
        },

        "correction_scope": {
          "type": "string",
          "enum": [
            "reading_focus",
            "access_points",
            "structural_questions",
            "interpretive_warnings",
            "non_permitted_transformations",
            "structural_reference",
            "function",
            "non_applicabile"
          ],
          "description": "Campo del dispositivo modificato dalla correzione. non_applicabile se correction_type è non_applicabile."
        },

        "correction_description": {
          "type": "string",
          "description": "Descrizione precisa della modifica applicata: cosa è cambiato nel dispositivo e come. Omesso se correction_type è non_applicabile."
        },

        "rationale": {
          "type": "string",
          "description": "Motivazione della scelta di correzione: perché questa modifica risolve (o non risolve) il breaking point, e quali vincoli ha rispettato."
        },

        "residual_limit": {
          "type": "string",
          "description": "Campo opzionale. Limite residuo dopo la correzione: cosa rimane parzialmente irrisolto anche dopo la modifica, e perché. Obbligatorio se correction_type è parzialmente_applicata."
        }

      }
    },

    "CorrectedReadingDevice": {
      "type": "object",
      "required": [
        "device_id",
        "theme_id",
        "domain",
        "device_type",
        "function",
        "structural_reference",
        "reading_focus",
        "access_points",
        "structural_questions",
        "interpretive_warnings",
        "non_permitted_transformations"
      ],
      "description": "Dispositivo di lettura configurazionale corretto. Struttura identica a F3 STEP 1 ReadingDevice. I campi non modificati dalle correzioni vengono riprodotti invariati dal dispositivo originale.",
      "properties": {
        "device_id": { "type": "string" },
        "theme_id": { "type": "string" },
        "domain": { "type": "string" },
        "device_type": { "type": "string", "const": "lettura_configurazionale" },
        "function": { "type": "string" },
        "structural_reference": {
          "type": "object",
          "required": ["core_configuration", "axes", "nodes", "bridge_concepts"],
          "properties": {
            "core_configuration": { "type": "string" },
            "axes": { "type": "array", "items": { "type": "string" } },
            "nodes": { "type": "array", "items": { "type": "string" } },
            "bridge_concepts": { "type": "array", "items": { "type": "string" } }
          }
        },
        "reading_focus": {
          "type": "array", "minItems": 3, "maxItems": 5,
          "items": {
            "type": "object",
            "required": ["dimension", "description"],
            "properties": {
              "dimension": { "type": "string" },
              "description": { "type": "string" }
            }
          }
        },
        "access_points": {
          "type": "array", "minItems": 2, "maxItems": 4,
          "items": {
            "type": "object",
            "required": ["label", "description"],
            "properties": {
              "label": { "type": "string" },
              "description": { "type": "string" }
            }
          }
        },
        "structural_questions": {
          "type": "array", "minItems": 4, "maxItems": 8,
          "items": { "type": "string" }
        },
        "interpretive_warnings": {
          "type": "array", "minItems": 2, "maxItems": 5,
          "items": {
            "type": "object",
            "required": ["risk_type", "description"],
            "properties": {
              "risk_type": {
                "type": "string",
                "enum": ["comportamentismo", "normatività", "tecnicismo", "riduzione_cognitiva"]
              },
              "description": { "type": "string" }
            }
          }
        },
        "non_permitted_transformations": {
          "type": "array", "minItems": 2,
          "items": { "type": "string" }
        }
      }
    }

  }
}
