{
  "step": "f3_step_3",
  "theme_id": "tema_07_ecosistema_digitale",
  "domain": "educativo (servizi per la prima infanzia, 0–6)",
  "source_device_id": "tema-07-ecosistema-digitale-educativo-dispositivo",
  "corrections_log": [
    {
      "breaking_point_ref": "case_01",
      "breaking_point_summary": "Il dispositivo si rompe sulla soglia di apertura della lettura: non distingue tra un servizio in cui la domanda strutturale non si è ancora aperta e un servizio in cui la grammatica della prestazionalizzazione del valore è completamente naturalizzata. In entrambi i casi il dispositivo non trova appigli e la non-leggibilità ha la stessa fenomenologia.",
      "correction_type": "parzialmente_applicata",
      "correction_scope": "reading_focus",
      "correction_description": "La dimensione 'Qualità strutturale e stati del campo desiderabile' viene articolata in tipologia non scalare degli stati: assente (per non-apertura della domanda strutturale o per saturazione naturalizzata), tentato-unilaterale (un polo apre il campo, l'altro non entra), tentato-in-attesa (un polo apre, l'altro è disponibile ma non risponde), condiviso (la co-presenza si stabilizza con durata strutturale). La descrizione della dimensione esplicita per ogni stato chi apre il campo, se e come l'altro vi entra, se esiste una durata strutturale della co-presenza. All'interno dello stato 'assente' viene specificato che la distinzione tra non-apertura della domanda e saturazione naturalizzata richiede proxy strutturali (pieghe non rendicontate, lessico interno del servizio, modi del confine identitario); quando questi proxy non sono identificabili, la zona va dichiarata esplicitamente come ambigua e l'ambiguità è trattata come informazione strutturale, non come fallimento della lettura.",
      "rationale": "L'articolazione interna dello stato 'assente' permette al dispositivo di non confondere assenza-come-non-attivazione e assenza-come-saturazione quando il contesto offre proxy strutturali. La dichiarazione esplicita di ambiguità nei casi privi di proxy rispetta il vincolo che impedisce di forzare la classificazione, e converte il limite in informazione strutturale. Si rispettano i vincoli: nessun nuovo asse, nessun nuovo nodo (articolazione interna del nodo 'campo-desiderabile'), nessuna scala di qualità; vincolo B onorato (chi apre / come l'altro entra / durata) e zona di sovrapposizione dichiarata.",
      "residual_limit": "Quando il servizio non offre alcuna piega né alcun lessico interno che faccia da proxy, la distinzione tra non-apertura e saturazione naturalizzata resta strutturalmente irrisolvibile dal dispositivo: in quei casi va dichiarata come zona di indistinguibilità. Questo limite è costitutivo della funzione del dispositivo come strumento di lettura di un campo già aperto e non è eliminabile a livello F3 STEP 1: richiederebbe un dispositivo distinto, dedicato alla soglia di apertura della domanda strutturale."
    },
    {
      "breaking_point_ref": "case_03",
      "breaking_point_summary": "Il dispositivo riconosce la distorsione strutturale (la grammatica della prestazionalizzazione opera in forma invertita, con segno opposto ma stessa struttura) ma non distingue tra distorsione totale e distorsione che mantiene pieghe non assorbite. Il dispositivo legge la struttura della distorsione, non la fenomenologia delle pieghe in cui la coabitazione si rompe o si attenua localmente.",
      "correction_type": "parzialmente_applicata",
      "correction_scope": "reading_focus",
      "correction_description": "La dimensione 'Coabitazione di livello tra mediazione adulta e organizzazione algoritmica del campo' viene articolata internamente lungo una tipologia funzionale della co-regolazione adulta: assente (la presenza non si attiva sul campo desiderabile), registrativa (la presenza riconosce il gesto del bambino ma non entra nel campo condiviso), partecipativa (la presenza entra nel campo condiviso sostenendone la co-presenza senza operare passaggi semiotici), trasformativa (la presenza consente il passaggio semiotico tra orientamento del bambino e oggetto culturale come co-produzione effettiva), chiudente (la presenza trasforma il gesto del bambino in azione predeterminata, script o restituzione — anche di tipo identitario invertito). La descrizione esplicita che la tipologia non è scala di qualità: per ogni classificazione vanno esplicitate la funzione strutturale svolta (apertura, sostegno, trasformazione, chiusura) e la ragione per cui la risposta non può essere classificata come il livello adiacente. La distinzione 'registrativa' vs 'chiudente' rende leggibile la differenza tra distorsione che mantiene pieghe non assorbite (registrativa: la grammatica invertita non chiude tutti i gesti) e distorsione totale (chiudente: ogni gesto viene riassorbito come performance, anche identitaria).",
      "rationale": "L'articolazione funzionale della co-regolazione introduce un asse di osservabilità più fine sulla qualità della distorsione: nei servizi con grammatica invertita, la prevalenza della funzione 'chiudente' (con segno invertito) discrimina dalla presenza di pieghe 'registrative' o 'partecipative' non assorbite. Si rispettano i vincoli: nessun nuovo nodo (la co-regolazione resta articolazione interna del nodo 'mediazione-strutturale' nella sua coabitazione con l'organizzazione algoritmica), divieto di scala (vincolo C) onorato attraverso la giustificazione funzionale per livello e l'obbligo di motivare la non-classificazione come livello adiacente.",
      "residual_limit": "La distinzione tra struttura della distorsione e fenomenologia delle pieghe in cui la coabitazione si attenua localmente resta solo parzialmente leggibile. La tipologia funzionale coglie le pieghe quando esse hanno articolazione strutturale (modi di rispondere al gesto), non quando sono pieghe sotto-strutturali (qualità del silenzio, qualità del ritmo, temporalità della pausa, tessitura sensoriale). Per quel piano sotto-strutturale il dispositivo continua a non disporre di articolazione interna: è un piano di tessitura, non di struttura, e la sua lettura eccede l'articolazione del dispositivo F3 STEP 1."
    },
    {
      "breaking_point_ref": "case_04",
      "breaking_point_summary": "Il dispositivo legge la configurazione come stato sincronico (presente / assente / distorta / oscillante / apparente) ma non dispone di un livello interno per cogliere la dimensione temporale della stabilizzazione, della cristallizzazione o della dispersione. La domanda 'questa oscillazione si sta strutturando o si sta cristallizzando come oscillazione permanente' non è formulabile nei termini propri del dispositivo.",
      "correction_type": "applicata",
      "correction_scope": "reading_focus",
      "correction_description": "Le dimensioni di lettura vengono articolate su tre livelli di scala temporale che la lettura deve tenere distinti: livello episodio (singolo momento di interazione, attività, transizione), livello sequenza (serie di episodi in una giornata, in una settimana, in un'unità di lavoro), livello struttura relazionale (forma stabilizzata della relazione tra mediazione adulta, organizzazione del servizio e campo desiderabile nel tempo lungo). La descrizione delle dimensioni — in particolare quelle sui stati del campo e sulla coabitazione adulto–organizzazione algoritmica — esplicita che il passaggio dal livello episodio al livello sequenza o struttura relazionale non avviene per conteggio o aggregazione percentuale di episodi: è necessario descrivere quale dimensione oscilla, se l'oscillazione è casuale o sistematica, a quali condizioni contestuali è legata (formalizzazione/informalità del momento, presenza/assenza di restituzione attesa, tipo di transizione istituzionale, posizione nella giornata). Se queste condizioni non sono identificabili, la lettura deve rimanere al livello episodico: la non-saliblabilità è informazione strutturale. Una structural_question dedicata interroga esplicitamente la temporalità della configurazione (oscillazione in stabilizzazione vs cristallizzazione come stato), e una non_permitted_transformation aggiuntiva nomina come collasso del dispositivo l'aggregazione quantitativa.",
      "rationale": "L'introduzione dei tre livelli di scala temporale rende il dispositivo capace di leggere configurazioni dinamiche senza ricadere in metriche aggregative che riassorbirebbero il dispositivo dentro la grammatica della prestazionalizzazione (vincolo D). Il passaggio sequenza→struttura relazionale è leggibile attraverso la sistematicità delle condizioni contestuali a cui l'oscillazione si lega, non attraverso conteggi. Si rispettano i vincoli: nessuna nuova dimensione, articolazione interna delle dimensioni esistenti, divieto di aggregazione quantitativa onorato."
    },
    {
      "breaking_point_ref": "case_05",
      "breaking_point_summary": "Il dispositivo nomina il rischio di assorbimento (negli interpretive_warnings sotto tecnicismo, nelle non_permitted_transformations come collasso in audit) ma il rischio si realizza precisamente quando la nominazione corretta del rischio diventa parte della performance corretta del lessico configurazionale. Non esiste, dentro il dispositivo, un livello che gli garantisca di restare fuori dalla grammatica della prestazionalizzazione del valore quando il dominio l'ha incorporata: la nominazione del rischio non è auto-resistente.",
      "correction_type": "parzialmente_applicata",
      "correction_scope": "interpretive_warnings",